Relationship,Sentence_Id,Sentence
N,18,"Warwick and Montague prepare to march to spar again with Margaret's forces, this time bringing the aid of York's other son George's troops"
N,34,"Edward sends Warwick to France to ask for the hand of the king of France's sister, and Margaret goes to France to ask for aid against Edward"
N,42,"In France, Warwick and Margaret arrive at the same time"
P,47,They receive news that Warwick and Margaret have joined forces
P,63,"Warwick's surviving supporters, Somerset and Oxford, go to join Margaret's army"
