Relationship,Sentence_Id,Sentence
P,13,"Pi clings to a lifeboat and encourages a tiger, Richard Parker, to join him (Parker)"
P,18,"The hyena kills the zebra and the orangutan, and then--to Pi's intense surprise--Richard Parker reveals himself: the tiger has been in the bottom of the lifeboat all along"
P,19,"Soon the tiger kills the hyena, and Pi and Richard Parker are alone together at sea"
P,25,"When the blind man attacks Pi, intending to eat him (man), Richard Parker kills him (Parker)"
P,27,"Pi and Richard Parker stay here for a time, sleeping in their boat and exploring the island during the day"
P,31,"Richard Parker runs off, and villagers take Pi to a hospital"
