Relationship,Sentence_Id,Sentence
N,11,"There, Jack and Charlie Northrup, another prominent local gangster, get into a fight"
N,16,"Shortly after they leave, the news reaches their boat that Charlie Northrup's bloodstained car has been found in Brooklyn with one of Jack's men"
N,35,Marcus learns that Northrup visited Jack one night
N,36,"Jack was angry because Northrup had tipped off federal agents about one of Jack's rum boats, so Jack proposed a partnership as a means of allowing Northrup to pay him (Jack) back"
N,37,"Northrup refused, and Jack had his (Jack) men beat him (Jack) up"
N,38,"When Northrup fought back, The Goose shot and killed him (Jack)"
