Relationship,Sentence_Id,Sentence
P,58,"Meanwhile, Caesar's adopted son and appointed successor, Octavius, arrives in Rome and forms a three-person coalition with Antony and Lepidus"
P,62,The two continue to prepare for battle with Antony and Octavius
P,64,Octavius and Antony march their army toward Brutus and Cassius
N,65,"Antony tells Octavius where to attack, but Octavius says that he (Antony) will make his (Antony) own orders; he (Antony) is already asserting his (Antony) authority as the heir of Caesar and the next ruler of Rome"
P,78,Octavius and Antony arrive
