Relationship,Sentence_Id,Sentence
N,19,"After a short time, Tom grows increasingly suspicious of his (Tom) wife's relationship with Gatsby"
N,20,"At a luncheon at the Buchanans' house, Gatsby stares at Daisy with such undisguised passion that Tom realizes Gatsby is in love with her (Daisy)"
N,22,"He (Tom) forces the group to drive into New York City, where he (Tom) confronts Gatsby in a suite at the Plaza Hotel"
N,23,"Tom asserts that he (Tom) and Daisy have a history that Gatsby could never understand, and he (Tom) announces to his (Tom) wife that Gatsby is a criminal--his (Tom) fortune comes from bootlegging alcohol and other illegal activities"
N,24,"Daisy realizes that her (Daisy) allegiance is to Tom, and Tom contemptuously sends her (Daisy) back to East Egg with Gatsby, attempting to prove that Gatsby cannot hurt him (Tom)"
N,25,"When Nick, Jordan, and Tom drive through the valley of ashes, however, they discover that Gatsby's car has struck and killed Myrtle, Tom's lover"
N,27,"The next day, Tom tells Myrtle's husband, George, that Gatsby was the driver of the car"
