Relationship,Sentence_Id,Sentence
P,20,Julian has been pestering Bradley to teach her (Rachel) about Hamlet and arrives one day for a tutorial
P,26,"By the next morning, she (Rachel) has determined that she (Rachel) loves him (Julian)"
N,27,Julian later confesses her (Rachel) love to her (Rachel) parents
N,30,"When Julian sneaks away from her (Rachel) parents' house, she (Rachel) and Bradley meet and leave for his (Bradley) rented cottage"
N,45,Rachel tells Bradley that Julian left him (Bradley) freely because she (Rachel) learned of Bradley's recent sexual encounter with Rachel -LRB-Rachel had described the encounter in a letter that Arnold delivered-RRB-
