Relationship,Sentence_Id,Sentence
P,77,"Rankeillor believes his (David) story, but David's uncle Ebenezer must be dealt with somehow"
P,80,"Rankeillor says the agreement is not legally binding, and that David is the true heir of the estate"
P,83,"Rankeillor, David, and Alan go to the House of Shaws"
P,88,"At that point, David and Rankeillor reveal themselves, having caught Ebenezer in the confession"
P,89,Ebenezer and Rankeillor then work out an agreement that David would get two-thirds of the yearly income of the House of Shaws
P,90,David receives a note from Rankeillor that will allow him (David) to collect his (David) money
