Relationship,Sentence_Id,Sentence
P,24,"Clara, however, realizes that her (Clara) mother's head has not been found and makes Ferula go with her (Clara) to find it"
P,26,"Over the years, Ferula and Clara have developed a deep friendship"
P,27,"Ferula's feelings for Clara border on passionate love, and she (Clara) and Esteban develop a rivalry over Clara's affections"
P,28,"One morning, Esteban comes home unexpectedly and finds Ferula in Clara's bed"
P,30,"As she (Clara) leaves, Ferula curses Esteban to eternal loneliness"
