Relationship,Sentence_Id,Sentence
N,14,Esther refuses him (Guppy)
N,58,Guppy visits Lady Dedlock in London and tells her (Dedlock) he (George) thinks there is a connection between her (Dedlock) and Esther
N,61,"When Guppy leaves, Lady Dedlock cries: Esther is her (Esther) daughter, who her (Esther) sister claimed had died at birth"
N,85,Esther visits Guppy and instructs him (Guppy) to stop investigating her (Esther)
N,125,"Bucket asks Esther to join him (Guppy), and they set out in search of Lady Dedlock in the middle of the night"
