Relationship,Sentence_Id,Sentence
P,2,"Doc Homer remembers his (Homer) daughters, Codi and Hallie, when they were young"
P,5,"Hallie leaves Tucson, Arizona, where she (Hallie) was living with Codi and Carlo, for Nicaragua"
P,7,"Shortly thereafter, Codi also leaves Tucson, returning to her (Hallie) small rural hometown, Grace, to care for her (Hallie) ailing father and to teach high school biology"
P,16,Codi and Hallie's mother died shortly after Hallie's birth
P,19,"Her (Hallie) father, the town doctor, was aware of the situation, but Codi still does not know this"
P,34,"All this time, Codi and Hallie, who have always been extremely close, exchange letters"
