Relationship,Sentence_Id,Sentence
P,15,"The busy city agrees with Scarlett's temperament, and she (Melanie) begins to see a great deal of Rhett"
P,22,"Rhett helps Scarlett and Melanie escape the Yankees, escorting them through the burning streets of the city, but he (Scarlett) abandons them outside Atlanta so he (Scarlett) can join the Confederate Army"
P,56,"After Melanie dies, Scarlett hurries to tell Rhett of her (Melanie) revelation"
P,57,"Rhett, however, says that he (Scarlett) has lost his (Scarlett) love for Scarlett, and he (Scarlett) leaves her (Melanie)"
P,58,"Grief-stricken and alone, Scarlett makes up her (Melanie) mind to go back to Tara to recover her (Tara) strength in the comforting arms of her (Tara) childhood nurse and slave, Mammy, and to think of a way to win Rhett back"
