Relationship,Sentence_Id,Sentence
P,3,"Only sixteen years old, John Grady runs away from home with his (Grady) friend Rawlins"
P,17,"When Don Hector finds out about it, he (Hector) turns John Grady and Rawlins over to the thuggish, corrupt police captain of Encantada"
P,19,"Now he (Grady) is being held in jail, and John Grady and Rawlins are accused of being his (Grady) co- conspirators"
P,21,"Blevins is executed, but John Grady and Rawlins are merely imprisoned in the town of Saltillo"
P,26,"Although Rawlins returns to Texas, John Grady is intent on reuniting with Alejandra"
