Relationship,Sentence_Id,Sentence
P,42,"Princesse passes a flirtatious drunk watching cockfights on her (Marie) way to visit Catherine, a foreign painter"
P,43,Princesse poses nude while Catherine paints and talks about art
P,44,"Princesse feels uncomfortable at first, but as long as no one else can see her (Catherine), she (Catherine) relaxes"
P,46,"When Catherine's mentor dies, Catherine goes to Paris without telling Princesse"
P,47,"When she (Catherine) returns, she (Catherine) gives Princesses a nude painting of her (Catherine) by the ocean"
