Relationship,Sentence_Id,Sentence
N,35,"Frustrated, Candide sails off to France with a specially chosen companion, an unrepentantly pessimistic scholar named Martin"
N,37,"Candide takes this as proof that there is justice in the world, but Martin staunchly disagrees"
N,38,"In Paris, Candide and Martin mingle with the social elite"
N,39,"Candide's fortune attracts a number of hangers-on, several of whom succeed in filching jewels from him (Martin)"
N,44,"Martin, Cacambo, and Candide depart for Turkey, where Candide purchases Cacambo's freedom"
