Relationship,Sentence_Id,Sentence
P,24,Ejlert Lövborg arrives and talks in earnest with Hedda while Tesman and Brack drink in the other room
P,27,Hedda plays Ejlert and Mrs
P,39,"Brack arrives and tells Hedda that Tesman left before Ejlert got into real trouble, that indeed he (Brack) has been arrested"
P,44,"Then, Ejlert confesses to Hedda that he (Brack) has, in fact, lost the manuscript and that he (Brack) wants to kill himself"
N,46,"He (Brack) leaves, and she (Hedda) burns the manuscript, referring to it as the child of Ejlert and Mrs"
