Relationship,Sentence_Id,Sentence
N,19,"When she (Linda) discovers that Benny and Ellen are to receive similar treatment, Linda hatches a desperate plan"
N,43,"Benny remains with Aunt Martha, and Linda is reunited with Ellen, who is now nine years old and living in Brooklyn, New York"
P,52,"There, she (Linda) is reunited with Benny"
P,54,"Flint now claims that the sale of Benny and Ellen was illegitimate, and Linda is terrified that he (Flint) will re-enslave all of them"
P,59,"When Linda returns to Boston, Ellen goes to boarding school and Benny moves to California with Linda's brother William"
P,69,"Linda refuses, unwilling to be bought and sold yet again, and makes plans to follow Benny to California"
