Relationship,Sentence_Id,Sentence
N,16,"The army commander, Bonzo Madrid, does not like Ender and does not want him (Ender) around"
N,18,"Ender helps the army by disobeying Bonzo, who hates Ender, but fortunately Ender is traded to Rat Army"
N,36,Bonzo is humiliated when Ender beats him (Ender)
N,37,"Bonzo attacks Ender in the shower room and Ender beats him (Ender), brutally, because he (Ender) was forced to"
N,50,Before he (Ender) goes Ender learns that he (Ender) did killed Bonzo as well as the bully back in school
